{
  "schemaVersion": "1",
  "status": "complete",
  "base": {
    "label": "main",
    "sourceRevision": "sha256:base-example",
    "configurationIdentity": "sha256:config-example",
    "status": "valid"
  },
  "head": {
    "label": "worktree",
    "sourceRevision": "sha256:head-example",
    "configurationIdentity": "sha256:config-example",
    "status": "valid"
  },
  "coverage": {
    "requested": [
      {
        "domain": {
          "dimensions": [{ "name": "theme", "default": "light", "values": ["light", "dark"] }],
          "key": "[[\"theme\",\"light\",[\"light\",\"dark\"]]]"
        },
        "clauses": [{}],
        "key": "[{}]"
      }
    ],
    "compared": [
      {
        "domain": {
          "dimensions": [{ "name": "theme", "default": "light", "values": ["light", "dark"] }],
          "key": "[[\"theme\",\"light\",[\"light\",\"dark\"]]]"
        },
        "clauses": [{}],
        "key": "[{}]"
      }
    ],
    "omitted": []
  },
  "changes": [
    {
      "changeId": "AAAAAAAAAAAAAAAAAAAAAAAAAAAAAAAAAAAAAAAAAAA",
      "kind": "direct-value",
      "token": "primitive.blue",
      "condition": {
        "domain": {
          "dimensions": [{ "name": "theme", "default": "light", "values": ["light", "dark"] }],
          "key": "[[\"theme\",\"light\",[\"light\",\"dark\"]]]"
        },
        "clauses": [{}],
        "key": "[{}]"
      },
      "sides": ["base", "head"],
      "before": {
        "source": {
          "document": "tokens/primitive.json",
          "range": { "line": 2, "column": 3, "offset": 4, "length": 42 }
        },
        "type": "color",
        "expression": "#0066cc",
        "resolvedValue": "#0066cc",
        "metadata": {},
        "dependencies": []
      },
      "after": {
        "source": {
          "document": "tokens/primitive.json",
          "range": { "line": 2, "column": 3, "offset": 4, "length": 42 }
        },
        "type": "color",
        "expression": "#0055bb",
        "resolvedValue": "#0055bb",
        "metadata": {},
        "dependencies": []
      }
    },
    {
      "changeId": "BBBBBBBBBBBBBBBBBBBBBBBBBBBBBBBBBBBBBBBBBBB",
      "kind": "propagated-value",
      "token": "semantic.action.primary",
      "condition": {
        "domain": {
          "dimensions": [{ "name": "theme", "default": "light", "values": ["light", "dark"] }],
          "key": "[[\"theme\",\"light\",[\"light\",\"dark\"]]]"
        },
        "clauses": [{}],
        "key": "[{}]"
      },
      "sides": ["base", "head"],
      "before": {
        "source": {
          "document": "tokens/semantic.json",
          "range": { "line": 2, "column": 3, "offset": 4, "length": 58 }
        },
        "type": "color",
        "expression": "{primitive.blue}",
        "resolvedValue": "#0066cc",
        "metadata": {},
        "dependencies": ["primitive.blue"]
      },
      "after": {
        "source": {
          "document": "tokens/semantic.json",
          "range": { "line": 2, "column": 3, "offset": 4, "length": 58 }
        },
        "type": "color",
        "expression": "{primitive.blue}",
        "resolvedValue": "#0055bb",
        "metadata": {},
        "dependencies": ["primitive.blue"]
      }
    }
  ],
  "renameCandidates": [],
  "impact": {
    "schemaVersion": "1",
    "changed": [
      {
        "token": "primitive.blue",
        "condition": {
          "domain": {
            "dimensions": [{ "name": "theme", "default": "light", "values": ["light", "dark"] }],
            "key": "[[\"theme\",\"light\",[\"light\",\"dark\"]]]"
          },
          "clauses": [{}],
          "key": "[{}]"
        },
        "sides": ["base", "head"]
      }
    ],
    "directlyAffected": [
      {
        "token": "semantic.action.primary",
        "condition": {
          "domain": {
            "dimensions": [{ "name": "theme", "default": "light", "values": ["light", "dark"] }],
            "key": "[[\"theme\",\"light\",[\"light\",\"dark\"]]]"
          },
          "clauses": [{}],
          "key": "[{}]"
        },
        "sides": ["base", "head"]
      }
    ],
    "indirectlyAffected": []
  },
  "backends": [
    {
      "changeId": "CCCCCCCCCCCCCCCCCCCCCCCCCCCCCCCCCCCCCCCCCCC",
      "backendId": "css",
      "kind": "symbol",
      "identity": "semantic.action.primary",
      "token": "semantic.action.primary",
      "before": "--semantic-action-primary",
      "after": "--action-primary"
    }
  ],
  "diagnostics": []
}
